{"events":[{"source":"oem_api","notes":"Front brake pads replaced. OEM verified.","event_id":"538a69ec-6e92-4055-aa75-99241e523cce","vehicle_id":"a1b2c3d4-e5f6-7890-abcd-ef1234567890","service_date":"2026-02-20","service_type":"brake_service","odometer_km":28000,"parts_replaced":[{"quantity":1,"part_name":"Front Brake Pads","part_number":"BP-FR-2024"}],"document_refs":[]},{"source":"oem_api","notes":"Full service. All systems nominal.","event_id":"870a38b3-a23f-4f38-86a7-02a01ce5a825","vehicle_id":"a1b2c3d4-e5f6-7890-abcd-ef1234567890","service_date":"2026-09-05","service_type":"full_service","odometer_km":35000,"parts_replaced":[{"quantity":1,"part_name":"Engine Oil 5W-30","part_number":"OIL-5W30-5L"},{"quantity":1,"part_name":"Oil Filter","part_number":"OF-2024A"},{"quantity":1,"part_name":"Air Filter","part_number":"AF-2024A"}],"document_refs":[]}],"vehicle_id":"a1b2c3d4-e5f6-7890-abcd-ef1234567890","total_services":2,"latest_service_date":"2026-09-05","latest_odometer_km":35000}