{"events":[{"source":"oem_api","notes":"Annual full service at certified dealer.","event_id":"c11fef7e-31ad-4490-9b63-2df57f3dd371","vehicle_id":"c3d4e5f6-a7b8-9012-cdef-123456789012","service_date":"2026-07-12","service_type":"full_service","odometer_km":42000,"parts_replaced":[{"quantity":1,"part_name":"Engine Oil 5W-30","part_number":"OIL-5W30-5L"},{"quantity":1,"part_name":"Oil Filter","part_number":"OF-2024A"}],"document_refs":[]},{"source":"self_upload","notes":"Receipt from local garage.","event_id":"b188c156-3c3a-4f9f-bf1a-ce79372e42dd","vehicle_id":"c3d4e5f6-a7b8-9012-cdef-123456789012","service_date":"2026-07-17","service_type":"oil_change","odometer_km":38500,"parts_replaced":[{"quantity":1,"part_name":"Generic Oil 5W-30","part_number":"GEN-5W30"}],"document_refs":["s3://paymu-docs/uploads/3ddfec7d-8eb7-4250-bbab-93a0077154ed.pdf"]}],"vehicle_id":"c3d4e5f6-a7b8-9012-cdef-123456789012","total_services":2,"latest_service_date":"2026-07-17","latest_odometer_km":38500}