{"events":[{"source":"self_upload","notes":"Local garage brake service. Receipt uploaded.","event_id":"6ef85b18-6ea7-44d7-80fa-f1b553f3f476","vehicle_id":"d4e5f6a7-b8c9-0123-defa-234567890123","service_date":"2025-12-20","service_type":"brake_service","odometer_km":25000,"parts_replaced":[{"quantity":1,"part_name":"Front Brake Pads","part_number":"BP-GENERIC"}],"document_refs":["s3://paymu-docs/uploads/0647e88f-7374-488c-86b0-7df98c80c202.pdf"]},{"source":"self_upload","notes":"Neighbourhood shop oil change receipt.","event_id":"66bd97c1-2bf2-423b-b9e6-647c2dd1736b","vehicle_id":"d4e5f6a7-b8c9-0123-defa-234567890123","service_date":"2026-09-25","service_type":"oil_change","odometer_km":30000,"parts_replaced":[{"quantity":1,"part_name":"Synthetic Oil 5W-30","part_number":"OIL-5W30-5L"}],"document_refs":["s3://paymu-docs/uploads/baf5971c-5090-4120-9fa2-9f9b0e5cf4f2.pdf"]}],"vehicle_id":"d4e5f6a7-b8c9-0123-defa-234567890123","total_services":2,"latest_service_date":"2026-09-25","latest_odometer_km":30000}